{
  "artifact_id": "sha256:f96b8e9d6c94dee97c7c65c011d29d686be88e1edcfc7a588262d5db795720a0",
  "authority": "evidence_only",
  "decision_disposition": "not_decided",
  "evidence_id": "ev-b040e654700f9a52",
  "kind": "static_analysis",
  "limitations": [
    "The analyzer reads CommonMark tokens and does not reproduce every hosting platform's Markdown extensions.",
    "Diagnostics identify inspectable properties; they do not measure README usefulness, correctness, or fitness for a specific audience.",
    "Repository links, rendered HTML, and prose semantics are outside this first analyzer."
  ],
  "occurrence_id": null,
  "payload": {
    "analyzer": {
      "adapter_kind": "builtin_python",
      "id": "markdown-structure-v1",
      "spec_sha256": "fc86aef9cc08ea381b3bdcf6ac0e705c706332d5e730f33e206eacbe22b19c07",
      "version": "1.0.0"
    },
    "configuration": {
      "enabled_rule_ids": [
        "empty-heading",
        "heading-level-jump",
        "image-missing-alt"
      ],
      "profile": "feedback"
    },
    "mode": "document_diagnostic",
    "run_id": "reademe-temp-forward-test-markdown-structure-v1",
    "subject": {
      "diagnostics": [],
      "incomplete_reason": null,
      "metrics": {
        "evaluated_rule_count": 3,
        "heading_count": 2,
        "image_count": 0,
        "line_count": 15
      },
      "native_artifact": null,
      "result": "completed",
      "skipped_rules": [
        {
          "reason": "excluded_from_selected_profile",
          "rule_id": "duplicate-heading-text"
        }
      ],
      "source": {
        "content_sha256": "f96b8e9d6c94dee97c7c65c011d29d686be88e1edcfc7a588262d5db795720a0",
        "kind": "candidate",
        "path": "intake/snapshots/reademe-temp-forward-test/forward-test/assembled/README.md",
        "repository": "k421o/readme-labs",
        "revision": "b10ff9c1ad032c6861b7d03463f52d9ac5d8e208"
      },
      "subject_id": "reademe-temp-forward-test-readme"
    }
  },
  "producer": {
    "id": "markdown-structure-v1",
    "kind": "static_analyzer",
    "spec_sha256": "fc86aef9cc08ea381b3bdcf6ac0e705c706332d5e730f33e206eacbe22b19c07",
    "version": "1.0.0"
  },
  "record_id": "rm-f96b8e9d6c94dee9",
  "recorded_at": "2026-08-31T02:44:42.285439Z",
  "result": "completed",
  "schema_version": 1,
  "source_records": [
    {
      "path": "experiments/runs/reademe-temp-forward-test-markdown-structure-v1/run.json",
      "role": "static_analysis_run",
      "selector": "subject_id=reademe-temp-forward-test-readme",
      "sha256": "910ebb0796b9fc4208fa84a7640f0ac30eeeac3a686e435a0f20fe4fda577d61"
    },
    {
      "path": "experiments/analyzers/markdown-structure-v1/analyzer.json",
      "role": "analyzer_spec",
      "selector": null,
      "sha256": "fc86aef9cc08ea381b3bdcf6ac0e705c706332d5e730f33e206eacbe22b19c07"
    }
  ],
  "subject_scope": "artifact",
  "summary": "0 diagnostics from markdown-structure-v1 using the feedback profile."
}
